{
  "$schema": "../criterion.schema.json",
  "criterion_id": "uk_sdr_v1_impact_additionality",
  "name": "Impact additionality (evidence of contribution to solution)",
  "regime": "uk_sdr_v1",
  "regulatory_anchors": [
    {
      "regulation": "FCA Policy Statement PS23/16: Sustainability Disclosure Requirements (SDR) and investment labels",
      "celex": "FCA-PS23-16",
      "article": "Chapter 4: Sustainability labels (paragraphs 4.32-4.38 — Sustainability Impact requires the asset to contribute to the solution, distinct from already-sustainable assets)",
      "url": "https://www.fca.org.uk/publication/policy/ps23-16.pdf"
    }
  ],
  "axes": ["project"],
  "applies_to": ["uk_sdr_impact"],
  "scoring_status": "implemented",
  "methodology_version_introduced": "v3.5",
  "summary": "Tests whether evidence is provided that the asset materially contributes to the named impact objective — the additionality test. PS23/16 ¶4.35 requires the contribution to be 'material' and 'attributable'. PB methodology v3.5 aligned band requires explicit additionality evidence: would this outcome have happened without this asset/financing? Acceptable forms include written additionality narrative referencing the counterfactual, sustainability-linked capital structure that ties cost-of-capital to outcome achievement, or evidence that the asset enables a step-change in sector performance (e.g. PUE materially below sector median in an underserved climate zone)."
}
