{
  "$schema": "../criterion.schema.json",
  "criterion_id": "sfdr_v1_dnsh_assessment",
  "name": "Do No Significant Harm (DNSH) assessment",
  "regime": "sfdr_v1",
  "regulatory_anchors": [
    {
      "regulation": "Regulation (EU) 2019/2088 (SFDR)",
      "celex": "02019R2088-20240109",
      "article": "Article 2(17)(b) (DNSH constituent of the sustainable investment definition)",
      "url": "https://eur-lex.europa.eu/legal-content/EN/TXT/?uri=CELEX:02019R2088-20240109"
    },
    {
      "regulation": "Commission Delegated Regulation (EU) 2022/1288",
      "celex": "02022R1288-20230220",
      "article": "Annex II / Annex III (DNSH sections of the pre-contractual templates)",
      "url": "https://eur-lex.europa.eu/legal-content/EN/TXT/?uri=CELEX:02022R1288-20230220"
    }
  ],
  "axes": ["project"],
  "applies_to": ["sfdr_v1_article_8", "sfdr_v1_article_9"],
  "scoring_status": "not_implemented",
  "methodology_version_introduced": "v3.3",
  "summary": "Tests whether the project demonstrates that it does no significant harm to any environmental or social objective in pursuit of the promoted E/S characteristic (Art 8) or sustainable investment objective (Art 9). DNSH is assessed at the project level under PB's developer-focused framing.",
  "successor_regime_note": "Under proposed SFDR 2.0 (Commission proposal COM(2025) 841, tabled 2025), DNSH is expected to be retained as a core safeguard across the new category regime. PB Art 8/Art 9 verdicts issued under methodology v3.3 are stamped to SFDR v1 (Reg 2019/2088 as consolidated 09/01/2024) and remain valid as of date of issue."
}
