{
  "$schema": "../criterion.schema.json",
  "criterion_id": "uk_sdr_v1_baseline_sustainability_assessment",
  "name": "Baseline sustainability assessment",
  "regime": "uk_sdr_v1",
  "regulatory_anchors": [
    {
      "regulation": "FCA Policy Statement PS23/16: Sustainability Disclosure Requirements (SDR) and investment labels",
      "celex": "FCA-PS23-16",
      "article": "Chapter 4: Sustainability labels (paragraphs 4.28-4.31 — Sustainability Improvers requires measurable baseline against which improvement is assessed)",
      "url": "https://www.fca.org.uk/publication/policy/ps23-16.pdf"
    }
  ],
  "axes": ["project"],
  "applies_to": ["uk_sdr_improvers"],
  "scoring_status": "implemented",
  "methodology_version_introduced": "v3.5",
  "summary": "Tests whether current performance metrics are measured at the asset to establish the baseline against which improvement is assessed. PS23/16 ¶4.28 requires Sustainability Improvers products to demonstrate measurable improvement; PB methodology v3.5 requires baseline values for three core data-centre metrics (current PUE, current renewable energy %, current GHG Scope 1+2) — the minimum set needed to verify an improvement trajectory is real rather than aspirational."
}
