{
  "$schema": "../criterion.schema.json",
  "criterion_id": "sfdr_v1_pre_contractual_disclosure",
  "name": "Pre-contractual disclosure completeness",
  "regime": "sfdr_v1",
  "regulatory_anchors": [
    {
      "regulation": "Regulation (EU) 2019/2088 (SFDR)",
      "celex": "02019R2088-20240109",
      "article": "Article 6 (pre-contractual transparency); Article 8 (Article 8 pre-contractual content)",
      "url": "https://eur-lex.europa.eu/legal-content/EN/TXT/?uri=CELEX:02019R2088-20240109"
    },
    {
      "regulation": "Commission Delegated Regulation (EU) 2022/1288",
      "celex": "02022R1288-20230220",
      "article": "Annex II (pre-contractual disclosure template for Article 8 products)",
      "url": "https://eur-lex.europa.eu/legal-content/EN/TXT/?uri=CELEX:02022R1288-20230220"
    }
  ],
  "axes": ["entity"],
  "applies_to": ["sfdr_v1_article_8", "sfdr_v1_article_9"],
  "scoring_status": "not_implemented",
  "methodology_version_introduced": "v3.3",
  "summary": "Tests whether the developer-entity's pre-contractual documentation discloses the SFDR-mandated content: the E/S characteristics or sustainable investment objective, the investment strategy that operationalises them, the use of designated reference benchmarks if any, and how sustainability risks are integrated.",
  "depends_on": ["sfdr_v1_e_s_characteristics_promotion"],
  "successor_regime_note": "Under proposed SFDR 2.0 (Commission proposal COM(2025) 841, tabled 2025), pre-contractual disclosure is expected to be restructured to align with the new category labels. PB Art 8/Art 9 verdicts issued under methodology v3.3 are stamped to SFDR v1 (Reg 2019/2088 as consolidated 09/01/2024) and remain valid as of date of issue."
}
