{
  "$schema": "../criterion.schema.json",
  "criterion_id": "sfdr_v1_good_governance_attestation",
  "name": "Good governance practices of investee / developer",
  "regime": "sfdr_v1",
  "regulatory_anchors": [
    {
      "regulation": "Regulation (EU) 2019/2088 (SFDR)",
      "celex": "02019R2088-20240109",
      "article": "Article 2(17) (definition of sustainable investment, including the good-governance constituent)",
      "url": "https://eur-lex.europa.eu/legal-content/EN/TXT/?uri=CELEX:02019R2088-20240109"
    },
    {
      "regulation": "Regulation (EU) 2019/2088 (SFDR)",
      "celex": "02019R2088-20240109",
      "article": "Article 8(1) (Article 8 product-level good-governance requirement)",
      "url": "https://eur-lex.europa.eu/legal-content/EN/TXT/?uri=CELEX:02019R2088-20240109"
    }
  ],
  "axes": ["entity"],
  "applies_to": ["sfdr_v1_article_8", "sfdr_v1_article_9"],
  "scoring_status": "not_implemented",
  "methodology_version_introduced": "v3.3",
  "summary": "Tests whether the developer's corporate parent demonstrates good governance practices: sound management structures, employee relations, remuneration of staff, and tax compliance. Under PB's SFDR review framing, the developer-entity stands in for what an FMP would assess at the investee level.",
  "successor_regime_note": "Under proposed SFDR 2.0 (Commission proposal COM(2025) 841, tabled 2025), the good-governance attestation is expected to remain as a baseline constituent of any sustainability-linked product category. PB Art 8/Art 9 verdicts issued under methodology v3.3 are stamped to SFDR v1 (Reg 2019/2088 as consolidated 09/01/2024) and remain valid as of date of issue."
}
